{
  "url": "https://www.anapioficeandfire.com/api/houses/1",
  "name": "House Algood",
  "region": "The Westerlands",
  "coatOfArms": "A golden wreath, on a blue field with a gold border(Azure, a garland of laurel within a bordure or)",
  "words": "",
  "titles": [],
  "seats": [],
  "currentLord": "",
  "heir": "",
  "overlord": "https://www.anapioficeandfire.com/api/houses/229",
  "founded": "",
  "founder": "",
  "diedOut": "",
  "ancestralWeapons": [],
  "cadetBranches": [],
  "swornMembers": []
}
